{
  "$schema": "https://json-schema.org/draft/2020-12/schema",
  "$id": "https://ingest.profit-base.online/exchange/v1/schemas/org-demand.schema.json",
  "title": "Org demand",
  "description": "Anonymised open demand of the units the member belongs to. Carries no names and no free text, except the orders of the member's Logistician units under exchange.demand.details, which carry the order's requester handle and comment but never an assignee.",
  "type": "object",
  "properties": {
    "materials": {
      "type": "array",
      "maxItems": 5000,
      "items": {
        "type": "object",
        "properties": {
          "material": {
            "$ref": "item-ref.schema.json"
          },
          "rawRefs": {
            "type": "array",
            "maxItems": 20,
            "items": {
              "$ref": "item-ref.schema.json"
            },
            "description": "Raw ores that refine into this material; possibly empty."
          },
          "minQuality": {
            "$ref": "quality.schema.json"
          },
          "openQuantity": {
            "$ref": "quantity.schema.json"
          },
          "source": {
            "type": "string",
            "enum": [
              "material-order",
              "item-order"
            ],
            "description": "Whether the line comes from a material order or from what an item order resolves to — never count item demand twice."
          }
        },
        "required": [
          "material",
          "rawRefs",
          "minQuality",
          "openQuantity",
          "source"
        ]
      }
    },
    "items": {
      "type": "array",
      "maxItems": 5000,
      "items": {
        "type": "object",
        "properties": {
          "item": {
            "$ref": "item-ref.schema.json"
          },
          "component": {
            "$ref": "component.schema.json",
            "description": "Ship components only."
          },
          "openQuantity": {
            "$ref": "quantity.schema.json"
          },
          "craftableByMe": {
            "type": "boolean"
          }
        },
        "required": [
          "item",
          "openQuantity",
          "craftableByMe"
        ]
      }
    },
    "updatedAt": {
      "type": "string",
      "format": "date-time",
      "description": "RFC 3339 timestamp in UTC."
    },
    "reason": {
      "type": "string",
      "enum": [
        "NOT_PERMITTED"
      ],
      "description": "Present only when the demand is withheld; both lists are then empty. NOT_PERMITTED: the member may not see their organisation's job orders. Absent when the member may see the demand, even if nothing is open. Treat an unknown value as withheld."
    },
    "orders": {
      "type": "array",
      "maxItems": 5000,
      "description": "Present only with exchange.demand.details and when the member is a Logistician of at least one unit they belong to: the open and in-progress orders those units are responsible for, by number. Absent otherwise, and when the demand is withheld. Orders of the member's other units stay summed in materials and items only.",
      "items": {
        "$ref": "#/$defs/order"
      }
    }
  },
  "required": [
    "materials",
    "items",
    "updatedAt"
  ],
  "$defs": {
    "order": {
      "type": "object",
      "description": "One open or in-progress job order a unit the member is a Logistician of is responsible for, with what it still needs. Names no assignee.",
      "properties": {
        "id": {
          "type": "string",
          "minLength": 1,
          "maxLength": 128,
          "description": "The job order's id, as an org-stock earmark names it. Opaque."
        },
        "number": {
          "type": "integer",
          "minimum": 1,
          "description": "The order's running number, shown as #number."
        },
        "type": {
          "type": "string",
          "enum": [
            "MATERIAL",
            "ITEM"
          ]
        },
        "status": {
          "type": "string",
          "enum": [
            "OPEN",
            "IN_PROGRESS"
          ]
        },
        "priority": {
          "type": "integer",
          "minimum": 1,
          "description": "The order's place in the Basetool's queue, 1 first; absent when it has none."
        },
        "unit": {
          "$ref": "#/$defs/unit",
          "description": "The unit responsible for the order."
        },
        "requestingUnit": {
          "$ref": "#/$defs/unit",
          "description": "The unit that placed the order and receives the goods."
        },
        "handle": {
          "type": "string",
          "maxLength": 255,
          "description": "The requester as the order's author typed it: free text, not a member account. Absent when empty."
        },
        "comment": {
          "type": "string",
          "maxLength": 1000,
          "description": "The order's comment: free text. Absent when empty."
        },
        "materials": {
          "type": "array",
          "maxItems": 1000,
          "description": "Per material and quality floor, what this order still needs: its requirement less the stock linked to it, never below zero. For an item order, the materials its items resolve to. Lines with nothing open are left out.",
          "items": {
            "type": "object",
            "properties": {
              "material": {
                "$ref": "item-ref.schema.json"
              },
              "minQuality": {
                "$ref": "quality.schema.json"
              },
              "openQuantity": {
                "$ref": "quantity.schema.json"
              }
            },
            "required": [
              "material",
              "minQuality",
              "openQuantity"
            ]
          }
        },
        "items": {
          "type": "array",
          "maxItems": 1000,
          "description": "Per game item, what an item order still needs: ordered less delivered less earmarked. Empty for a material order.",
          "items": {
            "type": "object",
            "properties": {
              "item": {
                "$ref": "item-ref.schema.json"
              },
              "component": {
                "$ref": "component.schema.json",
                "description": "Ship components only."
              },
              "openQuantity": {
                "$ref": "quantity.schema.json"
              }
            },
            "required": [
              "item",
              "openQuantity"
            ]
          }
        }
      },
      "required": [
        "id",
        "type",
        "status",
        "unit",
        "requestingUnit",
        "materials",
        "items"
      ]
    },
    "unit": {
      "type": "object",
      "properties": {
        "id": {
          "type": "string",
          "minLength": 1,
          "maxLength": 128,
          "description": "Opaque identifier issued by the Basetool. Clients store and echo it, never parse it."
        },
        "name": {
          "type": "string",
          "minLength": 1,
          "maxLength": 255
        }
      },
      "required": [
        "id",
        "name"
      ]
    }
  }
}
